{
  "schema_id": "stratai.support_preparation_protocol@1",
  "contract_version": "1.0.0-candidate.1",
  "protocol_id": "support_preparation_census/1.0.0-candidate.1",
  "design_reference": "support_preparation_census/0.1.0-design.1",
  "scope": "captured_preparation_checkpoints_research_only",
  "selection": "all_current_usable_directed_own_ally_pairs",
  "source_capture_contract": "fresh_replay_16hz_FrameDone_with_full_pawn_life@1",
  "unit": "match_protocol_epoch_instance_sequence_actor_ally",
  "t0": "current_FrameDone_before_future_window_not_necessarily_before_physical_movement",
  "history_required": false,
  "future_used_for_selection": false,
  "enemy_geometry_used_for_selection": false,
  "nominal_sample_hz": 16,
  "future_window_seconds": 2,
  "future_rule": "open_t0_closed_exact_horizon_complete_cadence_identity_side_phase",
  "future_censure_precedence": "horizon_availability_then_first_boundary_identity_or_actor_availability_failure",
  "position_change": "exact_exported_quantized_xyz_difference_not_intent_or_continuous_motion",
  "initial_features": "only_current_self_ally_positions_alive_availability_from_prefix",
  "pair_correlation": "opposite_directions_multiple_allies_and_overlapping_windows_are_not_independent_decisions",
  "actor_reason_precedence": [
    "ambiguous_actor_alias",
    "shared_pawn_reference",
    "unsupported_side",
    "disconnected",
    "native_identity_unavailable",
    "alive_unavailable",
    "not_alive",
    "position_unavailable"
  ],
  "execution_statuses": [
    "sampled_displacement",
    "no_sampled_displacement",
    "censored:missing_exact_horizon_sample",
    "censored:horizon_gap_or_boundary",
    "censored:identity_unavailable_or_changed",
    "censored:ambiguous_actor_alias",
    "censored:shared_pawn_reference",
    "censored:unsupported_side",
    "censored:disconnected",
    "censored:native_identity_unavailable",
    "censored:alive_unavailable",
    "censored:not_alive",
    "censored:position_unavailable"
  ],
  "decision_id": null,
  "physical_entry_accredited": false,
  "tactical_commitment_accredited": false,
  "comparison_allowed": false,
  "training_allowed": false,
  "product_supported": false
}
